{
  "schemaVersion": "1.0.0",
  "id": "required-parameter-added",
  "title": "Required exported parameter added",
  "description": "Adding a required parameter breaks existing callers of an exported function.",
  "tags": ["mvp-03", "typescript", "function-contract"],
  "snapshots": { "before": "before", "after": "after" },
  "capabilities": ["typescript.exports"],
  "expected": {
    "conclusion": "warn",
    "coverage": { "totalChangedFiles": 1, "analyzed": 1, "partiallyAnalyzed": 0, "unsupported": 0, "intentionallyExcluded": 0 },
    "requiredChanges": [{ "kind": "contract", "compatibility": "breaking", "componentName": "createInvoice" }],
    "forbiddenChanges": [], "requiredImpacts": [], "forbiddenImpacts": [], "requiredTests": [], "forbiddenTests": [],
    "requiredUnknowns": [], "forbiddenUnknowns": [], "requiredPolicies": [], "forbiddenPolicies": [],
    "requiredWaivers": [], "allowUnexpected": false
  }
}
